[
  {
    "question": "If the sequence 3, 7, 11, 15, ... is an AP, find the common difference d.",
    "choices": ["2", "3", "4", "5"],
    "answer": 2,
    "chapter": "Arithmetic Progression",
    "category": "Recall",
    "complexity": "low",
    "reason": "d = 7 - 3 = 4."
  },
  {
    "question": "Find the 12th term of the AP: 5, 9, 13, 17, ...",
    "choices": ["45", "49", "53", "57"],
    "answer": 1,
    "chapter": "Arithmetic Progression",
    "category": "Application",
    "complexity": "medium",
    "reason": "a = 5, d = 4. a<sub>12</sub> = 5 + 11×4 = 49."
  },
  {
    "question": "Which term of the AP 2, 5, 8, 11, ... is 50?",
    "choices": ["15", "16", "17", "18"],
    "answer": 2,
    "chapter": "Arithmetic Progression",
    "category": "Application",
    "complexity": "medium",
    "reason": "50 = 2 + (n-1)×3 ⇒ n = 17."
  },
  {
    "question": "Find the sum of first 10 terms of AP: 2, 4, 6, ...",
    "choices": ["100", "110", "120", "90"],
    "answer": 1,
    "chapter": "Arithmetic Progression",
    "category": "Application",
    "complexity": "medium",
    "reason": "S = (10/2) × (2 + 20) = 110."
  },
  {
    "question": "Find a<sub>20</sub> for AP 7, 10, 13, ...",
    "choices": ["64", "67", "70", "73"],
    "answer": 0,
    "chapter": "Arithmetic Progression",
    "category": "Application",
    "complexity": "low",
    "reason": "a<sub>20</sub> = 7 + 19×3 = 64."
  },
  {
    "question": "How many terms are there in AP: 5, 10, 15, ..., 100?",
    "choices": ["19", "20", "21", "22"],
    "answer": 1,
    "chapter": "Arithmetic Progression",
    "category": "Application",
    "complexity": "medium",
    "reason": "100 = 5 + (n-1)×5 ⇒ n = 20."
  },
  {
    "question": "Find the sum of first 20 natural numbers.",
    "choices": ["200", "210", "220", "230"],
    "answer": 1,
    "chapter": "Arithmetic Progression",
    "category": "Recall",
    "complexity": "low",
    "reason": "S = 20×21/2 = 210."
  },
  {
    "question": "Find the middle term of AP: 5, 9, 13, ..., 45",
    "choices": ["25", "27", "29", "31"],
    "answer": 0,
    "chapter": "Arithmetic Progression",
    "category": "Application",
    "complexity": "medium",
    "reason": "Middle term = (5 + 45)/2 = 25."
  },
  {
    "question": "Find the sum of AP: 3 + 7 + 11 + ... + 79",
    "choices": ["800", "820", "840", "860"],
    "answer": 1,
    "chapter": "Arithmetic Progression",
    "category": "Application",
    "complexity": "medium",
    "reason": "n = 20, S = 10 × (3 + 79) = 820."
  },
  {
    "question": "Which of the following is NOT an AP?",
    "choices": ["2, 4, 6, 8", "5, 10, 20, 40", "7, 7, 7, 7", "9, 6, 3, 0"],
    "answer": 1,
    "chapter": "Arithmetic Progression",
    "category": "Conceptual",
    "complexity": "low",
    "reason": "Second is geometric progression."
  },
  {
    "question": "Find d if a = 5 and a<sub>10</sub> = 50.",
    "choices": ["4", "5", "6", "3"],
    "answer": 1,
    "chapter": "Arithmetic Progression",
    "category": "Application",
    "complexity": "medium",
    "reason": "50 = 5 + 9d ⇒ d = 5."
  },
  {
    "question": "Find the sum of first 15 terms of AP: 1, 4, 7, ...",
    "choices": ["315", "330", "345", "360"],
    "answer": 1,
    "chapter": "Arithmetic Progression",
    "category": "Application",
    "complexity": "medium",
    "reason": "S = (15/2)(2 + 42) = 330."
  },
  {
    "question": "If a<sub>3</sub> = 10 and d = 2, find a.",
    "choices": ["6", "7", "8", "9"],
    "answer": 0,
    "chapter": "Arithmetic Progression",
    "category": "Application",
    "complexity": "medium",
    "reason": "a + 2d = 10 ⇒ a = 6."
  },
  {
    "question": "Find the sum of even numbers from 2 to 100.",
    "choices": ["2500", "2550", "2600", "2450"],
    "answer": 1,
    "chapter": "Arithmetic Progression",
    "category": "Application",
    "complexity": "medium",
    "reason": "n = 50, S = 25 × (2 + 100) = 2550."
  },
  {
    "question": "<b>Assertion (A):</b> In an AP, the common difference can be negative.<br><b>Reason (R):</b> The sequence can be decreasing.",
    "choices": ["A true R false", "A false R true", "Both true", "Both false"],
    "answer": 2,
    "chapter": "Arithmetic Progression",
    "category": "Conceptual",
    "complexity": "low",
    "reason": "AP can decrease, so d can be negative."
  },
  {
    "question": "Find the 5th term from the last of AP: 2, 5, 8, ..., 50",
    "choices": ["38", "41", "44", "47"],
    "answer": 0,
    "chapter": "Arithmetic Progression",
    "category": "Application",
    "complexity": "hard",
    "reason": "Total terms = 17, required term = 13th ⇒ 38."
  },
  {
    "question": "Find n if the sum of first n natural numbers is 210.",
    "choices": ["19", "20", "21", "18"],
    "answer": 1,
    "chapter": "Arithmetic Progression",
    "category": "Application",
    "complexity": "medium",
    "reason": "n(n+1)/2 = 210 ⇒ n = 20."
  },
  {
    "question": "Sum of first n odd numbers is:",
    "choices": ["n²", "n(n+1)", "2n", "n(n-1)"],
    "answer": 0,
    "chapter": "Arithmetic Progression",
    "category": "Recall",
    "complexity": "low",
    "reason": "Sum = n²."
  },
  {
    "question": "Find S<sub>5</sub> if a = 2 and d = 3.",
    "choices": ["40", "45", "50", "55"],
    "answer": 0,
    "chapter": "Arithmetic Progression",
    "category": "Application",
    "complexity": "low",
    "reason": "S = (5/2)(4 + 12) = 40."
  },
  {
    "question": "Which term of AP 3, 8, 13, ... is 78?",
    "choices": ["15", "16", "17", "18"],
    "answer": 1,
    "chapter": "Arithmetic Progression",
    "category": "Application",
    "complexity": "medium",
    "reason": "78 = 3 + (n-1)×5 ⇒ n = 16."
  },
  {
    "question": "How many multiples of 5 are there between 1 and 100?",
    "choices": ["19", "20", "21", "18"],
    "answer": 1,
    "chapter": "Arithmetic Progression",
    "category": "Application",
    "complexity": "low",
    "reason": "From 5 to 100 ⇒ 20 terms."
  },
  {
    "question": "If d = 0, the AP is:",
    "choices": ["Increasing", "Decreasing", "Constant", "Geometric"],
    "answer": 2,
    "chapter": "Arithmetic Progression",
    "category": "Conceptual",
    "complexity": "low",
    "reason": "All terms are equal."
  },
  {
    "question": "Find the sum: 10 + 7 + 4 + ... + (-20)",
    "choices": ["-35", "-40", "-45", "-30"],
    "answer": 2,
    "chapter": "Arithmetic Progression",
    "category": "Application",
    "complexity": "hard",
    "reason": "n = 11, S = (11/2)(-10) = -45."
  },
  {
    "question": "Find a if a<sub>5</sub> = 20 and d = 3.",
    "choices": ["5", "6", "7", "8"],
    "answer": 3,
    "chapter": "Arithmetic Progression",
    "category": "Application",
    "complexity": "medium",
    "reason": "20 = a + 12 ⇒ a = 8."
  },
  {
    "question": "Find the sum of first 25 multiples of 4.",
    "choices": ["1200", "1250", "1300", "1350"],
    "answer": 2,
    "chapter": "Arithmetic Progression",
    "category": "Application",
    "complexity": "medium",
    "reason": "S = (25/2)(4 + 100) = 1300."
  },
  {
    "question": "Find the nth term if a = 1 and d = 2.",
    "choices": ["2n", "2n-1", "2n+1", "n+2"],
    "answer": 1,
    "chapter": "Arithmetic Progression",
    "category": "Conceptual",
    "complexity": "low",
    "reason": "a<sub>n</sub> = 1 + (n-1)×2 = 2n - 1."
  }
]